{
  "schemaVersion": 1,
  "id": "double-six-dominoes",
  "name": "Double-Six Dominoes",
  "archetype": "dominoes",
  "summary": "A shared domino table with private hands for two to four players.",
  "players": { "minimum": 2, "maximum": 4 },
  "capabilities": { "multiplayer": true, "nearby": true, "ar": true },
  "resources": { "tableDesign": "domino-yard", "cardBack": "minimal-dark", "cardSet": "double-six-dominoes" },
  "deck": {
    "kind": "dominoes",
    "cards": [
      { "id": "domino-0-0", "text": "0 | 0" }, { "id": "domino-0-1", "text": "0 | 1" }, { "id": "domino-0-2", "text": "0 | 2" }, { "id": "domino-0-3", "text": "0 | 3" }, { "id": "domino-0-4", "text": "0 | 4" }, { "id": "domino-0-5", "text": "0 | 5" }, { "id": "domino-0-6", "text": "0 | 6" },
      { "id": "domino-1-1", "text": "1 | 1" }, { "id": "domino-1-2", "text": "1 | 2" }, { "id": "domino-1-3", "text": "1 | 3" }, { "id": "domino-1-4", "text": "1 | 4" }, { "id": "domino-1-5", "text": "1 | 5" }, { "id": "domino-1-6", "text": "1 | 6" },
      { "id": "domino-2-2", "text": "2 | 2" }, { "id": "domino-2-3", "text": "2 | 3" }, { "id": "domino-2-4", "text": "2 | 4" }, { "id": "domino-2-5", "text": "2 | 5" }, { "id": "domino-2-6", "text": "2 | 6" },
      { "id": "domino-3-3", "text": "3 | 3" }, { "id": "domino-3-4", "text": "3 | 4" }, { "id": "domino-3-5", "text": "3 | 5" }, { "id": "domino-3-6", "text": "3 | 6" },
      { "id": "domino-4-4", "text": "4 | 4" }, { "id": "domino-4-5", "text": "4 | 5" }, { "id": "domino-4-6", "text": "4 | 6" },
      { "id": "domino-5-5", "text": "5 | 5" }, { "id": "domino-5-6", "text": "5 | 6" }, { "id": "domino-6-6", "text": "6 | 6" }
    ]
  },
  "rules": { "initialHandSize": 7, "drawPerTurn": 1, "playPerTurn": 1, "turnOrder": "clockwise", "winCondition": "manual" },
  "presentation": { "accentStartHex": "0F766E", "accentEndHex": "0891B2", "supportsAR": true }
}
